Bullet,Rating
Is Google getting too smart?,3
How your keyword optimization efforts hurt you without you even knowing it.,0
3 easy ways to avoid a Google Slap ....,0
How to create a Client Getting Facebook Funnel without going broke,0
How to create a profitable client getting Facebook Funnel without going broke,0
How to create a funnel to get clients from Facebook,0
How many VA's you need to hire,0
"How many VAs do you need to manage to make $500,000 a year?",5
Do you need a facebook group?,0
How to run your facebook group?,0
Why You Should Treat Your Clients Like Evil Criminal Scumbags!,5
How to give yourself credibility when selling yourself to clients.,5
How to escape client work,0
How to give yourself INSTANT credibility when selling yourself to clients.,0
How to give yourself instant credibility when selling yourself to clients.,0
How to give yourself instant credibility when selling to clients.,0
How to give yourself credibility when selling to clients.,0
How to get your client's content produced,0
Should you write content for your clients?,0
What everyone must know before they start a Linkbuilding agency,0
5 ways to get perspective clients to like you.,0
"The 3 easiest markets ""rookie"" link builders can tap for maximum profit with minimum risk!",0
"The 4 easiest markets for ""rookie"" link builders",0
,0
1336.) The only 'work' Dan does for each client is - new client onboarding),0
What work YOU MUST do yourself and what you can leave up to your VAs.,0
What work can you outsource? What can you do yourself,0
"The work you must do yourself, and the work you can outsource.",0
How to make your VA team far more efficient (and effective) than 90% of the agencies out there with fulltime - in office staff.,5
How to make your VA team far more effective than an Agency with a staff of full-time employees...and a plan for doing it painlessly.,0
Why building a team of VAs can be one of the best investments you can make--and a plan for doing it painlessly.,0
How to make your team of VAs far more efficient (and effective) than 90% of the agencies out there with in house employees.,0
"How to make your team of VAs far more effective (and efficient) than 90% of the agencies out there with ""in office"" full time employees.",0
"How to mane your team of VAs to make them accomplish more (and at less cost) than 90% of the SEO agencies out there with an ""in office"" staff of full time employees.",0
595.) People tweeting out your links is shit,4
Should you ask for a tweet?,0
"Does getting tweets from influencers, count as getting links for your clients?",5
Does getting people to tweet your clients content count?,3
The terrible truth of getting tweets from clients,0
The terrible truth about tweets,0
The terrible truth about asking for tweets for your links,0
,0
How to get free links using your existing client list.,0
There are 4 easy to get link categories.  Here is how to choose the right one.,0
Thre are 6 types of content you can create for your clients.  Here is how to choose the right one.,0
How to double your guest post placesments just by changing two words in your email.c,0
3 things you should never do in your link outreach.,0
The 'core content' strategy for getting clients.,0
The easiest way ever to convince skeptical prospects to do business with you.,0
The easiest way ever to convince skeptical companies to hire your.,0
The easiest way ever to convince sketpical companies to work with you.,0
The easiest way ever to,0
Why all bloggers are liars (when it comes to money).,0
5 SEO Gimmicks that no longer work,0
SEO Gimmicks that you should avoid.,0
(Should you reach out to your link prospects before you have your guest post written to show them?),3
Do you need to have your guest posts written before you reach out to bloggers?,0
Can you reach out to bloggers before your guest post is written?,0
Can you reach out before you have written one word of your guest post?,0
Do you need to have written your guest posts before you ask someone to publish them?,0
,0
(some clients are 100% guest posts and some clients are 0% guest posts)),0
What clients are happy with guest posting and what clients hate it.,4
What clients want you to get guest posts and what clients hate it.,0
(651.) Combine 2 or 3 of the 3 viable blog post categories (1.) Theory/Explanation Post (What I'm gonna do) 2.) Detailed How To 3.) A Case Study (Here are the results of something I did) FOR ULTIMATE KICK ASS CONTENT),3
The three step formula for writing kick ass content.,0
The three step formula that will trap readers.,0
The full-proof formula for creating content that people will link to.,4
The full-proof formula for creating content that influencers will links to.,0
The full-proof formula for creating content that influential people will be happy to link to.,0
The full-proof formula for creating content that people love.,0
The full-proof formula for creating content people will link to (It even works in 'boring' industries).,0
Facebook's secret swipe file for writing ads so effective it gets people almost mad at you for interrupting their day because they can't resist reading your sales pitches!,3
The secret formula for writing content so effective it gets people almost mad at your for interrupting their day because they can't resist reading your blog posts!,0
"The secret formula for writing content so effective it gets people almost mad at you for having to drop everything, log-into thei	r wordpress, and give you a link!",0
,5
(1368.) Why Dan never does the 'Skyscraper method': There was 'NO WAY' to train his staff to do it.),0
Why Dan NEVER uses the 'Skyscraper' Method with clients.,0
Why you should NEVER use the 'Skyscraper' Method with Clients...and what to do instead.,0
Why almost everyone is wrong about the SKYSCRAPER METHOD,0
Why the SKYSCRAPER method is deadly if you run an agency,0
Why you should NEVER use the Skyscraper method on clients.,0
Why the SKYSCRAPER method is over-rated and will backfire on your best clients.,0
Can you train VA's to pull off the 'Skyscraper method',0
Why you should NOT EVEN BOTHER trying to find VA's show can pull off the 'Skyscraper method'...and what you should do instead.,0
How good does my content need to be in order to win links?,0
How good does my content need to be in order to get links?,0
How good should my content be if I want people to link to it?,0
"416.) The first step to creating content is to find the top 3 - 5 articles in the search results, and world and beat those""",5
A step-by-step plan for producing content.,3
"The simple ""two step for producing content""",0
"Do I always need to produce ""The best content on the internet"" in order to win a link?",0
A simple -- yet incredibly powerful -- method for ensuring that your content is good enough to win links.,0
A simple -- yet incredibly powerful -- method for producing content that is good enough to win links from influencers.,0
A simple -- yet incredibly powerful -- method for producing content -- that will earn links in any market.,0
A simple -- yet incredibly powerful -- method for producing content -- that will earn links in any market what-so-ever.,0
1368.) Why Dan never does the 'Skyscraper method': There was 'NO WAY' to train his staff to do it.,4
"This link building method is over-hyped and over recommended, you will go broke hiring VA's who can do it.",0
Do you always need to create the best content in your field?,0
What every SEO should know about the 'Skyscraper Method',0
Simple steps for building your content marketing empire online.,0
,0
(463.) Whenever you think of setting up / using a PBN think: will this PBN work better than getting 10 real local businesses to link to you?),0
Can you use a PBN? With corporate clients?,0
"What alwayss work better than a ""Private Blog Network"" PBN.",0
,0
3 Guaranteed ways to increase response to your guest post requests - without even touching your current copy!,0
,0
The exact word-for-word samples of sales letters that brought in millions... and how to adapt those same letters to your own business!,0
,0
(Core content piece),0
"Creating your ""core content piece.""",0
"Creating your ""client getting information kit.""",0
Generating leads with Facebook advertising.,0
Generating traffic to your Core Content piece with Facebook advertising.,0
Generating traffic to your Content piece with Facebook advertising.  Each step explained.,0
The easiest way to convince skeptical prospects to hire you.,0
,0
"A truly ""no brainer"" (yet unusually overlooked) way to bump the value of each client you get by 100% or more... with even less work on your part.",3
How to make yourself three times more likely to get hired.,0
How to make yourself 3x more likely to get hired.,4
Tips to make yourself three times more likely to get hired.,0
The single best way to develop a systematic client getting funnel.,0
The single best way to develop a systematic client getting funnel...that can't fail!,0
How to develop a systematic client getting funnel...that can't fail.,0
,0
The simple 7 word sentence that will make you the #1 candidate more often than you'd ever believe,0
"The one thing you should never, ever let a client do to you -- even if tell her ticks her off.",0
Give your,0
1323.) Once you know how to do something for your online business - sell it to other businesses.,0
If you have ever made any money online you are an expert...and can sell that knowledge for big money.,0
"((811.) One of Dan's most popular posts: """"Exactly how to create an seo agency in 2017""""""))",0
Exactly how to create an SEO Agency in 2018...in 5 easy steps,5
Exactly how to create an SEO AGency in 2018,0
How lay the groundwork for your SEO agency over christmas.,0
How to Create an SEO Agency in 2018,0
5 Easy Steps to Create an SEO Agency in 2018...that anyone can follow.,0
Quick-start steps for starting an Agency in 2018,0
How to Create an SEO Agency step-by-step.,0
How to Create a Link Building Agency step-by-step.,0
How to build your Link Building Agency web site. Plus: The what you must absolutely have on your site.,3
What you must absolutely have on your agency web site.,0
What you must have on your website.,0
"76.) How you can get links by getting bloggers on the phone -- just say - ""I have recently read that people are the average of the 5 people they spend most of their time with.""",0
How to network with bloggers even if you have no content and have realy done no work at all.,0
How to network with bloggers when you are so lazy you have done absolutely no work at all.,3
"How to network with bloggers when, despite your best efforts, you have't yet made even the slightest effort.",0
"How to network with bloggers when, despite your best efforts, you have refused to do any work at all.",0
"How to network with bloggers when, despite your best efforts, you have not yet done any work at all.",3
"How to network with bloggers when, despite your best efforts, you have not yet made any content (or put in any work at all.)",0
"How to networkwith bloggers when, despite your best efforts, you have not yet created any content (or done any work at all).",0
"614.) Why monetizing a YouTube audience with views is delusional 1 million views only equals 1,000 bucks""",0
Why most people are delusional about monetizing their YouTube audience.,3
"1070.) When evaluating creating a blog around a 'passion project' evaluate if there are viable affiliate offers, and viable CPA offers before you start.""",0
How to tell if your passion project has any hope of ever making money.,0
How to tell if your passion project has any reasonable hope of ever making money.,0
,0
,0
((513.) Get prospects to opt-in and send them a case study once a week),0
How to build and maintain a client waiting list.,0
"((1115.) 4-Microsite strategy VS a PBN: The difference is YOU ARE BUILDING 4 SEPARATE AUDIENCES (REAL FUCKING AUDIENCES WHO FOLLOW THE BLOG, OPT IN TO LIST ETC.) vs a PBN which is multiple sites of poop)",0
"Dan Ray's sneaky ""4-M"" strategy for corporate clients.",0
"Dan Ray's weird ""4-M"" strategy for corporate clients",0
How to build an army of mommy bloggers...who will do whatever your bidding is...on your corporate clients dime.,0
"How to use the other ""PBN"" strategy--small businesses don't have the resources for - but big clients do....because of its immediate ability to build massive amounts of links to your clients site - you can charge 10X what your competition does (It is also white hat - even when you do it like this).",0
The single best way ever discovered to build a White Hat PBN for your biggest clients.,0
WHITE HAT PBN! A substitue PBN that will never get your big clients into trouble.,0
FAKE PBN: The only private blog network strategy that you can safely use with your clients.,0
>>>The warning signs that a client is bad news.,3
>>>The warning signs that a client is not a good fit to deal with.,0
,0
,0
,0
,0
>How can I come up with good ideas for information products to sell to my customers online? Page 25.<,0
How can I come up with content ideas for even my most boring clients?,0
How do I come up with content ideas for even my most boring clients?,0
How to come up with content ideas for even your most boring clients?,0
"How to come up with content ideas for even your ""dull as dust"" clients",0
"How to come up with content ideas for even your ""dull as ditchwater"" clients.",0
How to make even the most mind numblingly boring and content free clients sound 100% worth linking to,0
((849)) Your content always has to be 100% non-commercial?)),0
Can you let your clients sell in the content you place for them?,0
Why letting your clients include their most powerful claims in their content...can destroy your campaign.,0
Why letting your clients include their most powerful claims in their content...can destroy your clink building campaign.,0
"653.) Readers want science: Hypothesis, Method, Results.""",0
((79)) Dan Ray's quick hustle plan...alltop --> buzzsumo ---> view sharers,0
A free plan make money this week providing a service.,4
Free plans for making money this week providing a remote service.,0
How to use BuzzSumo to make $500 a day.,0
How to use BuzzSumo to make $500 within 3 days from now.,0
How to use BuzzSumo to make $500 within the next three days.,0
An amazing secret that can turn others 'social media sharing' into a personal Gold mine.,0
An amazing secret that can turn others Twitter habits into a personal Gold mine.,0
An amazing secret that can turn others Facebook habits into a personal Gold mine.,0
An amazing secret that can turn strangers Facebook and Twitter habits into a personal Gold mine.,0
(655) Here are the 3 most common (and easiest) ways to get links 1: Reviews 2: Guest Posts 3: Sponsored Posts,5
Are guest posts really dead? (The answer may surprised you),0
The three easiest types of links to get.,0
What are the three easiest types of links to land?,0
Free plan for and template for going after the three easiest types of links.,0
Low cost sponsored posts. What sponsored posts will help your clients and which types of sponsored post should you avoid if you don't want to get into hot water.,0
How to get as many links as you need to get any website started...and how to do it without spending a lot of money.,0
((510)) Never charge by the hour,0
NEVER EVER charge by the hour...and what to do instead.,0
Why You Should Never charge by the hour...and what to do instead.,3
,0
((373.)) The only way to get backlinks to a ecommerce site is to create a shit load of content,0
"((997.))  The reason eCommerce stores are so difficult to get links for. The people who you are asking for links can see that you are directly monetizing traffic, even though that is true for any business, it  somehow freaks them out that it is soobvious.""",0
How to get links for eCommerce businesses?,0
How to get links for eCommerce websites,0
The only way to get links to eCommerce websites - for some reason everyone ignores this.,0
The only way to get links to an eCommere website.,4
Optimizing content for a eCommerce website.,3
Optimizing a campaign for an eCommerce website.,0
"How to find the best ""hook"" for promoting a ecommerce website and how to know when you've found it.",0
"How to find the best ""hook"" for a campaign promoting an ecommerce website and how to know when you've found it.",4
"How to find the best ""hook"" for building links to an ecommerce website and how to know when you've found it.",0
Building links to an eCommerce website is easy right? Wrong! Page 2 explains why.,0
"The very, very first step you should take, when building links to an eCommerce site, before you do anything else.",0
((1117.)) If you do an OK job outreaching to 200 different sites per month you will have a shitload of links.,0
How many 'link targets' do you need to contact,0
How many websites do you need to contact every month to win enough links for your clients?,4
How many websites do you need to contact every month to get 20 links?,0
How many websites do you need to find every month who will host your clients content?,0
Each month --- how many websites do you need to find to host your clients content?,0
How many websites do you need to prospect every month on behalf of your clients?,0
How many links do you need to win every month to keep your clients happy?,0
How many links per month does a BIG WHALE Client need to be happy?,0
How many links do you need to get each month to keep your clients happy?,0
How do you build your list of 'link targets' to contact on behalf of your clients every month?,0
How to train your VA's to find the ideal link prospects...so you don't have to micro-manage them.,0
How to train your VA's to find all the link targets you need on auto-pilot.,4
How to train your VA's to auto-pilot find all the link targets they could possible need on auto-pilot.,0
"((1316)) When you say """"Linkbuilding"""" and not SEO -- your quality of clients goes way up""",4
"539.) Using a technical term in your marketing is good if you are targeting a super specific audience. """"Link Builders""""""",0
,0
,0
((458)) When working for free - all you need to do each week is record what new traffic you got your victim,0
What you must do your FIRST MONTH in business -- that no one else does.,0
"The single most important ""first move"" you can make starting your agency -- it's what you know you should do, but most people panic and refuse to allow themselves to do it!",0
"Why you should do this one easy thing, ALL of your competitors are too lazy to attempt.",4
"Why you should do this one controversial thing, ALL of your competitors are too lazy to attempt.",0
What you must do your FIRST MONTH - that all of your competitors are much too lazy to even attempt.,0
What you must do your FIRST MONTH -- that all of your competitors are far too lazy to even attempt.,0
How Even Doing Moderates Amount of Work FOR FREE can increase your income.,0
How even doing very moderate amounts of work will skyrocket you past your competition.,0
What your guru never taught you about getting your first client.,0
A simple -- yet inredibly powerful -- method (that no one else does) for getting your first client.,0
The absolutely essential first thing you must do before you attempt to sell anything to anyone!,0
The absolutely essential first thing you must do before you attempt to sell SEO services to anyone!,4
The absolutely essential first thing you must do before you attempt to start a SEO agency!,0
The absolutely essential first thing you must do when you start a link building agency.,0
The absolutely FIRST THING you must do when you start a link building agency.,0
((1394)) Dan's health started to fail at 25.,0
What almost dying at 25 taught Dan about Linkbuilding,0
What impending death taught Dan,0
Health prevents Dan from doing daily blogging.,0
((191.)) Rank your writers from 1 - 5,0
How to build a team of outsourced writers,0
Exactly how to build and manage a team of outsourced writers.,0
Exactly how to build and manage a team of outsourced writers...and get your clients to pay for it.,0
Exactly how to get your clients to pay you to build a team of outsourced writers...you can use for world domination.,0
Exactly how to build a team of outsourced writers (on your clients dime) that you can use for world domination.,0
NEVER create contnet for your clients...how to build a team of outsourced writers on their dime.,0
,0
,0
((245.)) The content audit may be the most important piece of work your perform for you client,0
The most important part of any client engagement (This is the one thing you absolutely can't outsource),0
"Why the ""first thing"" you do with a client can not be outsourced (if you want happy clients paying maximum fees"")",0
The absolutely essential first thing you must do with a new client if you want to make maximum money (Don't even dream of outsourcing this step),0
The absolutely essential first thing you must do with a new client (,0
,0
((872.)) Buy blogs that indirectly serve your market but are not about what you sell,4
"How you can build an empire of bloggers, working for you, following your every order and whim, on your client's dime.",0
"How you can build an empire of bloggers, who work for you, on your clients dime.",0
"How you can build an empire of not just blogs but bloggers, on your clients dime.",0
Better than a PBN: How to get your client to 'buyout' the influential blogs in their niche...and use them to build links for ages.,0
How to get your client's to build a link...WARNING: It is very easy to mess this up - and get in BIG trouble with Google and fired (or worse) by your clients.,0
Better than a PBN: How to get your client to 'buy out' the top bloggers in your niche.  WARNING: There are a lot of ways to mess this up...and few ways to get it right.,0
"Better than PBNs: How to get your client to ""Buy Out"" the top bloggers in your niche.",0
How to skyrocket your links by buying-out the bloggers in your niche.,0
How to skyrocket your links by buying-out blogs on your clients dime.,5
Optimize your client's links by getting them to buy-out top quality bloggers.,0
"Skyrocket your links by getting your clients to buy-out, retain bloggers on their payroll -- which blogs they should choose.",0
How to know which blogs to buy.,0
Buying blogs can be link building gold...but you need to know which blogs to buy and which to avoid.,3
Buying blogs can be a link building gold mine...how to know which blogs to buy and which to avoid like the plague.,0
((1024.))  Dan charges $2000 for a meeting with a prospect.  If the client fee when working with the client.,0
How to get a prospective client to pay $2000 just for a meeting.,0
"How to get someone to pay $2000 so you can interview them, on why they deserve to have you work for them.",4
"How to get someone to pay $2000 so you can interview them, on why they are worthy of hiring you.",0
"How to charge $2,000 to let someone speak with you on the phone...and a twist that makes them even more likely to hire you.",5
"How to charge $2,000 for a phone call..and a twist to make this person even more likely to hire you...with a smile on their face.",0
"Why Dan can charge a prospect $2,000 to talk to them on the phone.",5
"How Dan can get a prospect to happily pay $2,000 to talk Dan on the phone...and make it a no-brainer for the client to hire him after their no-pressure talk.",0
"How You can get a prospect to happily pay you $2,000 to talk on the phone...and then make it a no-brainer for the client to hire you after your pleasant, no-pressure chat.",0
(1352.)  More than 10 clients is complete hell,4
How big a team do you need to run your agency?,0
How many clients can you work on at a time?,4
"If you only use VAs, how many clients can you handle at a time?",0
What is the most profitable number of clients to work with at any one time.,0
How many clients can you handle at any one time?,0
How many VAs does it take to manage 10 clients?,0
The way to automate all your client work - it only requires one quick meeting a week.,0
How to spend as little time on actually doing the work for your clients as possible.,0
How to spend 95% of your time working on your agency not in your agency.,3
What is the maximum number of clients Dan will work withh?,0
Easy Ways to oursource all of your client fufillment.,0
How many clients do you need to make over $500K a year?,0
How to make more money by working with less clients?,0
,0
,0
,0
629.) Dan's big success for getting links to a travel agency: Got clients to do monthly spotlights on specific hotels...those hotels gave the client a link,0
How Dan got links (without paying) in the tough travel niche... and how you can do the same thing with your clients.,0
The weird trick Dan used to get links (without paying) in the tough travel niche... and how you can do the same thing in any market!,0
The weird trick Dan used to get links (without paying) in the tough travel niche... and how you can do the same for any of your clients.,0
The weird trick Dan used to get links (without paying) in the tough travel niche... and how you can easily do the same for any of your clients...,0
Major opportunity for building links in the toughest niches (like Travel),4
How do I build links in even the toughest niches?,0
